{
  "profile_version": "1.0",
  "contract_version": "2.0",
  "object_type": "disposable_fixture_repair_result",
  "operation": "shadow_disposable_index_repair",
  "operation_id": "w3b-b-p1-operation-example",
  "result": "BLOCKED",
  "reason_code": "MUTATION_AUTHORIZATION_ABSENT",
  "reason": "The implementation exists but this record does not authorize mutation execution.",
  "state": "READY",
  "fixture_instance_id": "fixture-example-001",
  "binding_id": "w3b-b-p1-binding-example",
  "plan_id": "plan:w3b-a:fixture:001",
  "prestate_digest": "sha256:1111111111111111111111111111111111111111111111111111111111111111",
  "poststate_digest": null,
  "mutation_attempt_count": 0,
  "transaction_outcome": "NOT_STARTED",
  "mutation_effect": "NONE",
  "poststate_status": "NOT_EVALUATED",
  "disposal_state": "NOT_STARTED",
  "started_at": "2026-08-29T00:00:00Z",
  "completed_at": "2026-08-29T00:00:01Z",
  "scope": "DISPOSABLE_FIXTURE_ONLY",
  "evidence_class": "DECLARED_RESULT_EVIDENCE",
  "governance_status": "UNAUTHENTICATED_SHADOW",
  "effects": "NONE",
  "eligible_for_execution": false,
  "fixture_mutation_scope": "TEST_ONLY_DISPOSABLE_FIXTURE",
  "production_repair_effect": "NONE",
  "production_eligibility": false,
  "operational_entry_effect": "NONE"
}
